"Type","Category","Message"
"normal","Entertainment","Bro, the latest episode of Sacred Games is insane! Watched it yet? Let’s chat."
"fraud","Impersonation","Attention! Your PAN card is flagged. Update details now to avoid fines: http://pan-updateindia.net"
"fraud","Loan Scam","Last chance! Rs. 4 lakhs loan approved. Don’t miss out! Click: http://quickfunds.safeloan.co or dial 9876543210."
"normal","Travel","Packed for our Darjeeling trek. Bring warm clothes, it’s chilly!"
"fraud","Financial Fraud","URGENT: Your SBI net banking is locked. Restore access at http://sbi-safeaccess.com or risk account suspension!"
"normal","Travel","Flight to Bangalore delayed by 1 hour. Will update you soon."
"normal","Education","Heads-up, the Chemistry practical is rescheduled to Monday. Check the notice board."
"fraud","Fake Delivery Scam","Delhivery Notice: Urgent! Your package is delayed. Verify at http://delhivery-checknow.com or risk losing it!"
"fraud","Job Offer Scam","IMMEDIATE OPENING! ₹600/day from home. No skills needed. Hurry: http://easyearnindia.org"
"normal","Family","Bhai, need your advice on something. Call me when free?"
"fraud","Identity Theft","Immediate action needed! Protect your Aadhaar at http://id-lockindia.in or face legal consequences!"
"normal","Social","Hey, craving some vada pav. Wanna grab a bite today?"
"fraud","Job Offer Scam","HURRY! Work-from-home job, ₹40,000/month. Apply before it’s gone: http://topcareerhub.in"
"fraud","Financial Fraud","ATTENTION: Rs. 2,000 withdrawn without consent. Confirm at http://bankalert-secure.com to stop further loss!"
"fraud","Subscription Scam","Hurry! Your Voot subscription will be deactivated. Save it at http://voot-indiaupdate.com before midnight!"
"normal","Work Update","Just a heads up, deadline for the report is today by 5 pm. Hurry!"
"fraud","Lottery Scam","Urgent! Your Rs. 7 lakh lottery win expires today! Visit http://claimlottery.prizehub.in to grab it now! Don’t miss out!"
"fraud","Investment Scams","Emergency! Double your money in 48 hrs with our secret plan. Act fast: http://instawealth-ind.com"
"fraud","Lottery Scam","Urgent Alert! Rs. 12 lakh lottery win expires in 24 hrs! Visit http://lotterybonus.getquick.in to claim immediately!"
"fraud","Fake Delivery Scam","Flipkart Delivery: Parcel on hold due to ₹50 fee. Pay immediately at http://flipkart-payfee.com to get it delivered!"
"normal","Sports","Hey, hockey match on TV tonight. India vs Aus. Watch party?"
"normal","Sports","Saw the India-Pakistan match rerun. Goosebumps, man!"
"normal","Travel","Reminder: Visa docs for Dubai trip due tomorrow. Send me yours ASAP."
"fraud","Job Offer Scam","DREAM JOB! Earn ₹25,000/month remotely. Slots closing today! Visit: http://fastjobsecure.net"
"fraud","Phishing","Bank of Baroda Alert: Suspicious transaction detected. Secure account at http://bob-safetycheck.in urgently!"
"fraud","Service Fraud","Warning! Your mobile number will be blocked. Pay dues at http://safe.mobileverify-ind.com to prevent this!"
"fraud","Loan Scam","Instant cash! Rs. 3.5 lakhs loan for you. Zero hassle! Apply: http://moneyquick.loantrust.in or dial 9887766554."
"fraud","Financial Fraud","EMERGENCY: Your Axis Bank account is compromised. Update details at http://axis-safeguard.com immediately!"
"normal","Delivery Update","Hey, your order is on the move! Likely to reach by tomorrow morning."
"fraud","Impersonation","Hi, this is Anil from Accounts. Need Rs. 1500 in Paytm vouchers for an urgent payment. Reply with codes!"
"normal","Delivery Update","Quick update: Your delivery is set for today. Keep an eye out!"
"normal","Work Update","Hey, the boss wants updates on the Delhi project. Ping me ASAP."
"normal","Sports","Hey, cricket practice at the local ground at 5 PM. You coming?"
"fraud","Investment Scams","Exclusive! Earn ₹20,000 in a week with our RBI-backed plan. Join: http://safeinvest-india.net"
"fraud","Emotional Manipulation","Mom, I’ve been in a car crash in Bangalore. Need Rs. 6,000 for treatment. Click http://accident-aid.in. I’m in pain!"
"normal","Sports","Bro, our school football team won 3-2! What a comeback!"
"normal","Family","Hey Mom, missing your aloo parathas! Coming over this weekend."
"normal","Delivery Update","Hi, your item is en route. Delivery expected by tomorrow in Mumbai."
"normal","Entertainment","Yo, there’s a stand-up comedy show in Delhi this Sat. Vir Das live! Coming?"
"normal","Recreation","Hi, let’s play badminton at the club tomorrow evening. Game on?"
"normal","Education","Reminder: Submit your project report by 5 PM today on the college portal. Don’t miss it!"
"fraud","Impersonation","Hi, it’s Priya, your manager. Buy Rs. 3000 in Flipkart gift cards for a client. Text codes ASAP. Critical!"
"fraud","Tech Support Scam","Emergency! Hacker access on your device. Call 1-844-222-3344 immediately to stop theft!"
"fraud","Subscription Scam","Your MX Player Premium is at risk. Update payment at http://mxplayer-indiafix.com or lose benefits today!"
"fraud","Identity Theft","Help! Your identity details are leaked. Secure them at http://id-rescueindia.in before it’s too late!"
"normal","Social","Just saw your story—those lehenga vibes! Coffee soon?"
"fraud","Impersonation","Hi, it’s Ravi from HR. Need Rs. 2000 in Amazon gift cards for a team reward. Send codes now. Urgent!"
"fraud","Phishing","Emergency! Your Paytm wallet is compromised. Protect it now at http://paytm-safetyzone.in or risk losing funds!"
"fraud","Impersonation","Income Tax Dept: Your refund is blocked due to an error. Resolve immediately at: http://itax-refundindia.com"
"fraud","Emotional Manipulation","Papa, I’m in deep trouble. Got arrested in Delhi. Need Rs. 10,000 for bail. Help urgently at http://bailout-india.com. I’m scared!"
"normal","Education","Reminder: Pay your semester fees by this Friday to avoid late fines. Hurry!"
"normal","Delivery Update","Hey, your package has been delivered! Drop us a msg if there’s any issue."
"normal","Travel","Booked a cab for our Agra trip tomorrow. Taj Mahal, here we come!"
"normal","Service Inquiry","Hi, do you have any packages for wedding photography?"
"normal","Sports","Yo, let’s play gully cricket tomorrow morning. Bring your bat!"
"fraud","Tech Support Scam","Warning! Malware detected on your system. Click http://techsafe-india.com to fix it urgently!"
"fraud","Job Offer Scam","JOB ALERT! Earn ₹30,000/month from home. Limited seats! Apply now at: http://quickjobindia.co"
"normal","Social","Your latest reel on Insta is hilarious! Let’s hang out, na?"
"fraud","Lottery Scam","Congrats! You've won Rs. 5 lakhs in the Diwali Lottery! Claim now at http://diwalibonus.winfast.in or lose it by midnight!"
"normal","Travel","Hey, just booked our Goa trip for New Year! Check WhatsApp for the itinerary."
"normal","Recreation","Hi, wanna try paragliding in Lonavala this weekend? Sounds fun!"
"normal","Service Inquiry","Hi, are there any special Diwali offers on your services?"
"fraud","Emotional Manipulation","Bro, I’m injured after a fight in Pune. Need Rs. 5,500 for hospital bills. Help at http://urgentmed-india.com. I’m suffering!"
"fraud","Impersonation","Urgent! This is Aadhaar Office. Link your number or face suspension: http://aadhaar-linknow.org"
"fraud","Investment Scams","Warning! Miss this & lose big! ₹500 = ₹5000 in 5 days. Go to: http://rapidprofit-delhi.com"
"fraud","Financial Fraud","CRITICAL: Your PNB debit card is suspended. Reactivate now at http://pnb-cardrestore.com or lose access!"
"normal","Social","Hey, how’s it going? Been a while since we caught up!"
"fraud","Investment Scams","Invest ₹1000 today, get ₹8000 by next week! Limited offer, click: http://goldencash-india.com"
"normal","Entertainment","Hey, the new Bollywood movie trailer is out! Looks epic. Wanna watch it this Fri?"
"normal","Delivery Update","Good news! Your order is on its way and should reach by evening today."
"normal","Education","Good news! Library is open till 8 PM this week for exam prep. Grab your books!"
"normal","Delivery Update","Update: Your order is coming! Should be at your doorstep by 5 PM."
"fraud","Lottery Scam","Alert! You’ve won Rs. 8 lakhs in the National Lottery! Claim at http://lotterywin.secureprize.in or risk losing it today!"
"normal","Family","Sis, let’s plan a Rakhi surprise for Bhai. Ideas?"
"fraud","Lottery Scam","Winner! Rs. 4 lakh lottery prize is yours! Click http://claimwin.lottozone.in now to avoid losing this golden chance!"
"normal","Service Inquiry","Hey, what’s the estimated time for a car service at your garage?"
"fraud","Identity Theft","Warning! Your personal info is compromised. Act now at http://safeid-guard.in or lose access to services!"
"normal","Delivery Update","Yo, your parcel is heading to Delhi. Should arrive by tomorrow eve."
"normal","Service Inquiry","Hi, do you provide home delivery in Mumbai? Pls confirm."
"fraud","Financial Fraud","WARNING: Suspicious activity on your ICICI card. Secure it at http://icici-cardverify.com before it’s blocked!"
"normal","Travel","Reminder: Our train to Jaipur leaves at 6 PM. Don’t be late!"
"fraud","Fake Delivery Scam","IndiaPost Alert: Your parcel is stuck due to a ₹99 fee. Pay now at http://indiapost-paynow.com to avoid return!"
"fraud","Subscription Scam","Emergency! Your Zee5 subscription is suspended. Reactivate at http://zee5-restore.in before it’s too late!"
"normal","Recreation","Hey, let’s catch the sunrise at Marine Drive this Sunday. You in?"
"fraud","Tech Support Scam","Alert! Your data is at risk. Call 1-800-123-4567 now for Tech Support before it’s too late!"
"fraud","Identity Theft","Critical! Aadhaar data breach detected. Confirm identity at http://aadhaar-safenet.in to prevent fraud!"
"fraud","Subscription Scam","Warning! Your Spotify Premium will be cancelled tonight. Fix payment at http://spotify-indiaupdate.com now!"
"normal","Entertainment","Did u hear? Arijit Singh is performing in Mumbai next month. Should we get tix?"
"fraud","Fake Delivery Scam","BlueDart Warning: Delivery delayed! Update address urgently at http://bluedart-fixinfo.com or lose your package!"
"normal","Family","Mom, got your fave saree cleaned. Bringing it tomorrow."
"fraud","Tech Support Scam","Urgent! Suspicious activity on your device. Click http://indiasafe-tech.com to secure it fast!"
"fraud","Investment Scams","Hurry! Double your Diwali savings in 24 hrs! Click now: http://festivewealth-ind.com Don’t wait!"
"normal","Social","Hey, wanna join for a quick chai at the tapri tonight?"
"fraud","Tech Support Scam","Alert! Your device is infected with a virus. Call 1-800-456-7891 now to secure it before data loss!"
"normal","Work Update","Can you send the presentation slides by evening? Client is waiting."
"fraud","Emotional Manipulation","Sis, I’m stranded in Mumbai after a theft. Lost everything. Send Rs. 5,000 via http://helpme-survive.in. I’m all alone!"
"normal","Sports","Wanna join for a volleyball game at the beach this Sunday?"
"fraud","Service Fraud","Danger! Your mobile data will be stopped in 2 hours. Pay at http://data.safepay-ind.com to continue using!"
"normal","Family","Dad, can you help with my bike repair? I’ll drop by tomorrow."
"normal","Entertainment","Hey, let’s hit up a Dandiya event this weekend. Bring ur fam, it’ll be a blast!"
"fraud","Lottery Scam","Congratulations! Rs. 6 lakh lottery win confirmed! Hurry, claim at http://getlottery.bonusclaim.in before deadline tonight!"
"fraud","Service Fraud","Critical! Your Jio plan is overdue. Prevent deactivation by paying at http://jio.urgentpaylink.in now!"
"normal","Education","Hey, join the webinar on career options today at 3 PM. Link is on WhatsApp group."
"fraud","Loan Scam","Financial crisis? Rs. 4.5 lakhs loan ready. Apply now: http://easycash.loanindia.biz or call 9223344556."
"fraud","Investment Scams","Last chance! Triple your savings overnight! Secure spot at: http://fastmoney-mumbai.com Now!"
"fraud","Subscription Scam","Urgent! Your Netflix subscription is expiring today. Update payment now at http://netflix-renewal.in to avoid losing access!"
"normal","Service Inquiry","Hey, can you tell me if my order is ready for pickup today?"
"fraud","Emotional Manipulation","Didi, I lost my job and house in Kolkata. Need Rs. 8,000 to survive. Send to http://crisis-support-india.com. I’m broken!"
"normal","Work Update","Yo, let’s discuss the project over chai at 4 pm in the office."
"fraud","Fake Delivery Scam","Ecom Express Alert: Your order is stuck. Update info at http://ecomexpress-update.com or face cancellation!"
"normal","Education","Hey, tomorrow’s lecture is online due to heavy rains in Mumbai. Check your email for the Zoom link!"
"fraud","Subscription Scam","Your SonyLIV account is about to expire. Don’t miss out, update at http://sonyliv-indiafix.net urgently!"
"fraud","Fake Delivery Scam","FedEx India: Unpaid ₹150 fee blocking your parcel. Settle now at http://fedex-indiapay.com to release it!"
"normal","Social","Hey, missed you at the Ganpati celebrations. Meet up this week?"
"fraud","Service Fraud","Warning! Your Airtel connection expires in 6 hours. Renew at http://secure.airtelrenewal.co to stay connected!"
"fraud","Phishing","Alert! HDFC Bank detected suspicious activity. Secure your account at http://hdfc-safeguard.co.in before it’s too late!"
"normal","Travel","Just checked into our hotel in Udaipur. The lake view is amazing!"
"fraud","Lottery Scam","Lucky Winner! Rs. 10 lakhs lottery prize awaits! Secure it at http://lotteryjackpot.getnow.co.in before it’s transferred!"
"fraud","Impersonation","HDFC Bank Alert: Your net banking is locked. Reactivate now at: http://hdfc-loginsecure.in"
"normal","Delivery Update","Yo, your delivery is scheduled for tomorrow. Keep your phone handy!"
"fraud","Financial Fraud","ALERT! Rs. 5,000 debited from your HDFC account. Verify if it’s not you at http://hdfc-securecheck.com now!"
"fraud","Impersonation","Urgent! This is SBI. Your account is at risk. Verify now to avoid suspension: http://sbi-safeaccess.in"
"normal","Recreation","Yo, planning a cricket match at the local ground tomorrow. Join us!"
"fraud","Emotional Manipulation","Bhai, my child is sick in hospital. Need Rs. 7,000 for surgery. Please save us at http://childcare-emergency.com. I’m helpless!"
"fraud","Tech Support Scam","Warning! Trojan virus on your device. Visit http://fixit-indianow.com to clean it urgently!"
"fraud","Service Fraud","Urgent! Your internet access is blocked. Restore it at http://fix.netconnect-india.org before it’s too late!"
"fraud","Job Offer Scam","JOB OPPORTUNITY! Earn ₹800/day remotely. Act fast! Click now: http://quickhiretoday.co"
"normal","Recreation","Let’s hit the Sanjay Gandhi National Park for a trek. Saturday ok?"
"fraud","Subscription Scam","Your Hotstar subscription is at risk. Update details immediately at http://hotstar-verifyindia.com or lose access!"
"fraud","Impersonation","Hi, it’s Meena, your team lead. Need Rs. 2500 in Google Play cards for a project. Send codes immediately!"
"fraud","Investment Scams","Alert! Invest ₹500 & earn ₹5000 in 7 days! Limited slots, click now: http://quickgain-india.com Hurry!"
"normal","Sports","Yo, gym sesh at FitZone at 6. Let’s lift some weights!"
"fraud","Loan Scam","Alert! Rs. 3.2 lakhs loan pre-approved for you. Don’t wait! Apply: http://cashnow.loanfast.in or dial 9445566778."
"normal","Work Update","Check WhatsApp for the new work roster. Let me know if any issues."
"fraud","Job Offer Scam","ACT NOW! Work-from-home, ₹600/day. Miss this & regret! Visit: http://easyjobfind.co.in"
"fraud","Loan Scam","Hurry! Rs. 1.5 lakhs loan offer ending soon. No documents! Click: http://fastfunds.secureloan.net or call 9334455667."
"normal","Work Update","Hey, team meeting at 11 am tomorrow. Don’t be late, yaar!"
"normal","Education","Great news! Our college fest is back on 15th Aug. Get ready for some fun!"
"normal","Social","Bro, your cricket match pics are dope! Let’s play a game soon."
"fraud","Financial Fraud","DANGER: Your Kotak account is under threat. Protect it at http://kotak-shieldnow.com before it’s too late!"
"normal","Family","Dad, how’s your health? I’ll come check on you soon."
"fraud","Loan Scam","Urgent! Rs. 3 lakhs loan waiting for you. No paperwork! Apply now: http://instantcash.loanpro.in or call 9123456789."
"fraud","Job Offer Scam","URGENT! Earn ₹500/day from home. Don’t delay, apply now at: http://instantworkindia.in"
"normal","Education","Hey, the Maths test is tomorrow. Revise those formulas tonight, okay?"
"normal","Work Update","Reminder: Submit your timesheet by EOD. Thanks, dost!"
"normal","Sports","Hey, badminton at the club at 7 PM. Racket ready?"
"normal","Work Update","Please update the CRM with today’s client calls. Important hai!"
"fraud","Service Fraud","Attention! Your BSNL line is under suspension. Pay at http://bsnl.quickresolve.net to avoid disconnection!"
"fraud","Investment Scams","Rare chance! Turn ₹1000 into ₹10,000 this week with our BSE tips. Join: http://stockrich-now.com"
"normal","Entertainment","Yo, IPL match tonight! CSK vs MI. Let’s grab some chai and watch at my place."
"fraud","Job Offer Scam","EXCITING OFFER! ₹50,000/month remote work. Limited slots! Click: http://bestjobportal.org"
"normal","Work Update","Meeting with the Mumbai team at 1 pm on Zoom. Be ready!"
"fraud","Service Fraud","Alert! Your mobile service will be disconnected today. Pay now at http://urgent.mobilepay-india.com to avoid cutoff!"
"fraud","Lottery Scam","Congrats! Rs. 2 lakh lottery prize awaits! Don’t delay, claim at http://winlottery.cashnow.in before it’s reassigned!"
"normal","Delivery Update","Great news! Your package will arrive today. Stay tuned for updates."
"fraud","Loan Scam","Don’t delay! Rs. 2 lakhs loan approved for emergencies. Click: http://urgentcash.loansecure.co.in or call 9776655443."
"fraud","Phishing","Warning! Your Kotak Bank account is at risk. Verify identity at http://kotak-safenet.in to prevent blockage!"
"fraud","Identity Theft","Danger! Your bank account is linked to fraud. Verify identity at http://securebank-id.in to avoid closure!"
"fraud","Tech Support Scam","Critical! System breach detected. Click http://safeindia-techguard.com to resolve now!"
"normal","Work Update","Hi, tomorrow’s off for Diwali prep. Enjoy the break!"
"normal","Entertainment","Dude, the trailer for Pathaan 2 dropped. SRK looks killer! Cinema this week?"
"normal","Travel","Landed in Mumbai! Heading to grab some vada pav. Talk soon!"
"normal","Sports","Did you catch the IPL match last night? CSK nailed it!"
"fraud","Subscription Scam","Alert! Your Amazon Prime membership payment failed. Secure it at http://prime-indiafix.com before suspension!"
"normal","Recreation","Hey, let’s check out the new escape room in Bandra. Sounds exciting!"
"fraud","Emotional Manipulation","Aunty, my family is starving after floods in Assam. Send Rs. 3,000 via http://floodrelief-now.in. We’ve lost everything!"
"fraud","Fake Delivery Scam","DTDC Notice: Your shipment is on hold. Confirm details at http://dtdc-urgentverify.com within 12 hours!"
"fraud","Financial Fraud","URGENT: Your Canara Bank KYC is incomplete. Update at http://canara-kycverify.com to avoid account freeze!"
"normal","Service Inquiry","Hi, do you offer online consultations for medical advice?"
"normal","Recreation","Wanna go for a jog at Shivaji Park tomorrow morning? Let’s do it!"
"fraud","Identity Theft","Emergency! Your voter ID is under threat. Secure it at http://voteid-protect.in or risk deactivation!"
"fraud","Job Offer Scam","LAST CHANCE! ₹35,000/month remote job. No experience needed. Visit: http://safejoboffer.net"
"normal","Entertainment","Hey, let’s binge Mirzapur S3 this weekend. Heard it’s even crazier. U in?"
"fraud","Fake Delivery Scam","IndiaPost Warning: Your parcel is at risk of return. Pay ₹120 fee at http://indiapost-feeupdate.com now!"
"fraud","Identity Theft","Alert! Verify your PAN card details immediately at http://pan-secureverify.co.in to avoid penalties!"
"normal","Social","Yo, your Holi video was epic! When are we chilling next?"
"fraud","Financial Fraud","ALERT: Refund of Rs. 3,500 awaiting. Claim it at http://bankrefund-india.com before expiry in 24 hours!"
"normal","Education","Yo, don’t forget the parent-teacher meet this Saturday at 11 AM in school. Be there!"
"normal","Recreation","Planning a bike ride to Matheran. You coming along this weekend?"
"fraud","Phishing","ICICI Bank Warning: Your account needs verification. Click http://icici-verifyportal.in or face suspension today!"
"normal","Social","Saw your Diwali pics on Insta, looking fab! Let’s meet soon."
"fraud","Job Offer Scam","URGENT HIRING! Work-from-home, ₹500/day. Don’t miss out! Click: http://dreamworkonline.in"
"fraud","Loan Scam","Need money now? Rs. 5 lakhs loan, no credit check! Click: http://fastloan.securemoney.in or call 9001234567."
"normal","Service Inquiry","Hi, can you share the price list for your salon services?"
"normal","Family","Hey guys, let’s do a video call tonight. Miss seeing you all!"
"fraud","Investment Scams","Don’t miss! ₹200 investment = ₹2000 profit by tomorrow! Click: http://cashsurge-india.online"
"fraud","Identity Theft","Warning! Your PAN details are at risk. Confirm now at http://pan-safetycheck.in to avoid fines!"
"fraud","Phishing","Fraud Alert! Your PhonePe account shows odd activity. Protect it at http://phonepe-securehub.in immediately!"
"fraud","Emotional Manipulation","Ma, I’m trapped in Hyderabad, no money for food. Send Rs. 2,000 to http://hunger-aid.in. I’m desperate for help!"
"fraud","Identity Theft","Urgent! Your identity is at risk. Secure your Aadhaar now at http://protect-idindia.in or face account suspension!"
"normal","Service Inquiry","Hey, what are your working hours on Sundays in Delhi?"
"normal","Family","Mom, I’m running late from office. Save some dal for me!"
"fraud","Phishing","Attention! Your Axis Bank account shows unusual login. Verify at http://axis-protectnet.in to avoid fraud!"
"normal","Social","Saw your post from Goa—jealous! Tell me all about it soon."
"normal","Family","Hey fam, Diwali shopping this Saturday. Who’s in?"
"normal","Recreation","Hey, up for a Bollywood movie marathon at my place tonight?"
"normal","Service Inquiry","Hey, is there a waiting list for appointments this week?"
"normal","Delivery Update","Hey buddy, your parcel is out for delivery. Expect it by noon today."
"fraud","Tech Support Scam","Help! Hacker threat detected. Call 1-844-555-6677 to save your personal info immediately!"
"fraud","Subscription Scam","Alert! Payment issue with your JioCinema subscription. Resolve now at http://jiocinema-secure.in to continue streaming!"
"fraud","Financial Fraud","WARNING: Fraud detected on your IDBI account. Secure it at http://idbi-protectnow.com or face deactivation!"
"fraud","Identity Theft","Alert! Suspicious activity on your Aadhaar. Verify now at http://aadhaar-checksafe.in to stay protected!"
"fraud","Fake Delivery Scam","XpressBees Alert: Shipment pending due to missing info. Update at http://xpressbees-verify.com within 24 hrs!"
"normal","Family","Sis, can you send me that kheer recipe? Craving it!"
"normal","Travel","Just arrived in Delhi. The chaat here is calling my name. Catch up later!"
"fraud","Emotional Manipulation","Dad, I’m in jail in Chennai for a misunderstanding. Need Rs. 9,000 for release. Save me at http://legalrescue-india.com!"
"fraud","Investment Scams","Urgent! Make ₹50,000 in 10 days with our NIFTY strategy. Register: http://profitwave-ind.com"
"normal","Travel","Hey, reached Chennai! Can’t wait to try some idli-sambar. Call you in a bit."
"fraud","Tech Support Scam","Critical! Virus alert on your phone. Visit http://securetech-bharat.com to remove it now!"
"normal","Entertainment","Wanna join me for a Garba night this Navratri? Gonna be so much fun!"
"fraud","Loan Scam","Emergency funds! Rs. 2.5 lakhs loan ready. Apply before it’s gone: http://cashurgent.loanindia.net or call 9988001122."
"fraud","Fake Delivery Scam","Amazon Logistics: Delivery failed due to wrong address. Fix it at http://amazonlogi-fix.com before it’s returned!"
"fraud","Lottery Scam","Wow! Rs. 3 lakhs lottery prize is yours! Click http://winlottery.quickcash.in to confirm before it’s given to someone else!"
"fraud","Phishing","Urgent! Your SBI account is at risk. Verify now at http://sbi-securecheck.in or lose access! Call 1800-123-4567 if issues."
"fraud","Lottery Scam","Big News! Rs. 9 lakhs lottery prize is waiting! Secure it at http://lotteryreward.fastwin.in or it will be forfeited!"
"fraud","Service Fraud","Emergency! Your broadband is at risk of suspension. Settle dues at http://quick.netfix-ind.com immediately!"
"normal","Sports","Kabaddi trials happening at the stadium. Wanna check it out?"
"fraud","Phishing","Critical! Your Google Pay account is under threat. Reset password at http://gpay-securelink.in now!"
"fraud","Emotional Manipulation","Uncle, I’m stuck in Goa, wallet stolen. Need Rs. 4,000 to get home. Help at http://stranded-help.net. I’m begging!"
"normal","Service Inquiry","Hey, can I book a slot for a consultation this Friday?"
"normal","Education","Don’t miss the guest lecture on AI tomorrow at 10 AM in the auditorium. Be on time!"
"fraud","Phishing","URGENT! Your PAN Card details need verification. Click http://pan-secureupdate.in or face penalty from Income Tax Dept!"
"fraud","Impersonation","Hello, this is your ICICI Bank. Unusual activity detected. Secure your account: http://icici-verifysecure.co"
"fraud","Tech Support Scam","Danger! Your system is compromised. Call 1-855-987-6543 ASAP to protect your files!"
"fraud","Subscription Scam","Critical! Your ALTBalaji account needs urgent verification. Click http://altbalaji-check.in to avoid cancellation!"
